{
  "schema_version": "sat-sim.experiment-record.v1",
  "experiment_id": "phase3d_proxy_diagnostic_smoke:train-adcs_rw_jam-000:nominal",
  "generated_at_utc": "2026-07-25T18:50:32Z",
  "lineage": {
    "campaign_id": "phase3d_proxy_diagnostic_smoke",
    "pair_id": "train-adcs_rw_jam-000",
    "case_role": "nominal",
    "simulation_run_id": "phase3d_proxy_diagnostic_smoke-train-adcs_rw_jam-000-nominal",
    "dataset_id": "phase3d_proxy_diagnostic_smoke-train-adcs_rw_jam-000-nominal",
    "independent_run_id": "train-ADCS_RW_JAM-000",
    "astrograph_case_id": null,
    "experiment_template_id": "adcs.rw_jam.basilisk.v1"
  },
  "engine": {
    "name": "python",
    "backend": "python",
    "capability_id": "subsystem.adcs_fidelity.v1",
    "bsk_version": "unavailable",
    "platform_version": "0.1.0",
    "runtime_fidelity": {
      "simulation_engine": "non_basilisk_test_runtime",
      "fidelity_level": "C_TEST_PROXY_ONLY",
      "formal_training_eligible": false,
      "reason": "non_basilisk_execution",
      "capability_id": "subsystem.adcs_fidelity.v1",
      "backend": "python",
      "bsk_version": "unavailable",
      "bsk_version_accepted": false,
      "runtime_truth_status": null,
      "instantiated_module_count": 0,
      "allowed_purposes": [
        "unit_test",
        "interface_test",
        "agent_workflow_test"
      ],
      "flight_validated": false
    }
  },
  "execution": {
    "status": "complete",
    "seed": 20260726,
    "duration_s": 8.0,
    "sample_s": 1.0,
    "solver_step_s": 0.2,
    "task_spec_sha256": "127133ff7cb7521ec5686e2124ff6295d6f8b09d9f768d68f42b995fb8e42b0b",
    "randomization_policy": "paired fault/nominal cases share seed and initial parameters"
  },
  "spacecraft_and_environment": {
    "target": {
      "level": "subsystem",
      "name": "adcs",
      "mode": "nominal"
    },
    "parameters": {
      "initial_attitude_error_deg": 15.148732,
      "initial_rate_deg_s": [
        0.02698219,
        0.04800069,
        0.0955463
      ],
      "initial_wheel_speed_rad_s": [
        88.861444,
        71.6856,
        108.48713
      ],
      "control_kp_nm_per_rad": 0.12736152,
      "control_kd_nm_per_rad_s": 0.91881453,
      "gyro_noise_std_deg_s": 0.001842262
    },
    "simulation_extra": {
      "backend": "python"
    }
  },
  "fault_injection": {
    "ground_truth": {
      "class_id": "NORMAL",
      "case_role": "nominal",
      "pair_id": "train-adcs_rw_jam-000",
      "fault_case_id": "phase3d_proxy_diagnostic_smoke-train-adcs_rw_jam-000-fault",
      "nominal_case_id": "phase3d_proxy_diagnostic_smoke-train-adcs_rw_jam-000-nominal",
      "simulator_effect": null,
      "simulator_event_kind": null,
      "onset_time_s": null,
      "end_time_s": null,
      "severity": null,
      "severity_descriptor": {},
      "target": "adcs.reaction_wheel.1"
    },
    "event_definitions": {
      "faults": [],
      "degradations": [],
      "constraints": []
    }
  },
  "runtime_summary": {
    "schema_version": "adcs1.adcs_fidelity.v1",
    "fidelity_level": "medium",
    "model_family": "orbit_adcs_fidelity_candidate_adcs_proxy",
    "can_claim_high_fidelity": false,
    "reason_high_fidelity_still_blocked": "ADCS-1 adds environmental torque, sensor, actuator, and controller-mode proxies plus ADCS-2 benchmark envelopes, but it is not calibrated FSW or sensor/actuator hardware physics.",
    "qoi": {
      "adcs.initial_pointing_error_deg": 15.148732,
      "adcs.final_pointing_error_deg": 10.053776538157159,
      "adcs.max_pointing_error_deg": 15.148732,
      "adcs.min_pointing_error_deg": 10.053776538157159,
      "adcs.settled_time_s": null,
      "adcs.convergence_ratio": 0.6636711599464007,
      "adcs.quaternion_norm_max_error": 1.1102230246251565e-16,
      "adcs.saturation_count": 0,
      "adcs.max_abs_rate_rad_s": 0.018372266268521124,
      "adcs.max_abs_wheel_speed_rad_s": 110.49098358741921,
      "adcs.max_rw_power_w": 8.915915380532459,
      "adcs.environment.total_torque_norm_nm": 2.4400204917172318e-06,
      "adcs.sensor.dropout_count": 0,
      "adcs.rw.max_abs_momentum_nms": 8.839278686993536,
      "adcs.control.mode_trace_available": 1.0
    },
    "validation_preview": {
      "quaternion_norm_within_1e-9": true,
      "pointing_error_reduced": true,
      "wheel_speed_within_limit": true,
      "validation_gate_status": "preview_only_pending_HF8_physical_validation_gates"
    },
    "known_physics_limits": [
      "Environmental torques are deterministic proxies, not a calibrated orbital disturbance model.",
      "Star tracker, sun sensor, and gyro are measurement proxies; no hardware calibration or detailed failure dynamics are modeled.",
      "Reaction-wheel allocation is a proxy and does not model motor electronics or a full wheel geometry matrix.",
      "Controller is still a deterministic PD/controller-mode proxy, not flight software.",
      "ADCS-2 benchmark envelopes are internal regression tolerances, not flight-data validation."
    ],
    "config": {
      "schema_version": "hf4.adcs_closed_loop.basic.v1",
      "epoch_utc": "2000-01-01T12:00:00Z",
      "duration_s": 8.0,
      "sample_s": 1.0,
      "integration_step_s": 0.2,
      "solver_method": "euler",
      "inertia_kg_m2": [
        12.0,
        10.0,
        8.0
      ],
      "initial_quaternion_body_to_ref": [
        0.9912746122512593,
        0.0,
        0.0,
        0.1318129094820216
      ],
      "target_quaternion_body_to_ref": [
        1.0,
        0.0,
        0.0,
        0.0
      ],
      "initial_rate_rad_s": [
        0.0004709280548986888,
        0.0008377700837291169,
        0.0016675975230982581
      ],
      "target_mode": "inertial",
      "target_reference_vector": [
        1.0,
        0.0,
        0.0
      ],
      "control_kp_nm_per_rad": 0.12736152,
      "control_kd_nm_per_rad_s": 0.91881453,
      "pointing_requirement_deg": 1.0,
      "disturbance_torque_nm": [
        0.0,
        -2.4400000000000004e-06,
        -1e-08
      ],
      "gyro_bias_rad_s": [
        0.0,
        0.0,
        0.0
      ],
      "gyro_noise_std_rad_s": 3.215353758437577e-05,
      "sun_sensor_noise_rad": 0.0,
      "star_tracker_available": true,
      "sun_sensor_available": true,
      "reaction_wheels": {
        "num_wheels": 3,
        "configuration": "orthogonal_3",
        "allocation_method": "weighted_pseudoinverse",
        "wheel_inertia_kg_m2": 0.08,
        "max_torque_nm": 0.05,
        "max_speed_rad_s": 900.0,
        "idle_power_w": 2.0,
        "power_per_torque_w": 80.0,
        "axes_body": [
          [
            1.0,
            0.0,
            0.0
          ],
          [
            0.0,
            1.0,
            0.0
          ],
          [
            0.0,
            0.0,
            1.0
          ]
        ],
        "axis_mapping": "explicit_body_frame_spin_axis_matrix"
      },
      "initial_wheel_speed_rad_s": [
        88.861444,
        71.6856,
        108.48713
      ]
    },
    "adcs1_fidelity": {
      "schema_version": "adcs1.adcs_fidelity.v1",
      "closed_loop": {
        "schema_version": "hf4.adcs_closed_loop.basic.v1",
        "epoch_utc": "2000-01-01T12:00:00Z",
        "duration_s": 8.0,
        "sample_s": 1.0,
        "integration_step_s": 0.2,
        "solver_method": "euler",
        "inertia_kg_m2": [
          12.0,
          10.0,
          8.0
        ],
        "initial_quaternion_body_to_ref": [
          0.9912746122512593,
          0.0,
          0.0,
          0.1318129094820216
        ],
        "target_quaternion_body_to_ref": [
          1.0,
          0.0,
          0.0,
          0.0
        ],
        "initial_rate_rad_s": [
          0.0004709280548986888,
          0.0008377700837291169,
          0.0016675975230982581
        ],
        "target_mode": "inertial",
        "target_reference_vector": [
          1.0,
          0.0,
          0.0
        ],
        "control_kp_nm_per_rad": 0.12736152,
        "control_kd_nm_per_rad_s": 0.91881453,
        "pointing_requirement_deg": 1.0,
        "disturbance_torque_nm": [
          0.0,
          -2.4400000000000004e-06,
          -1e-08
        ],
        "gyro_bias_rad_s": [
          0.0,
          0.0,
          0.0
        ],
        "gyro_noise_std_rad_s": 3.215353758437577e-05,
        "sun_sensor_noise_rad": 0.0,
        "star_tracker_available": true,
        "sun_sensor_available": true,
        "reaction_wheels": {
          "num_wheels": 3,
          "configuration": "orthogonal_3",
          "allocation_method": "weighted_pseudoinverse",
          "wheel_inertia_kg_m2": 0.08,
          "max_torque_nm": 0.05,
          "max_speed_rad_s": 900.0,
          "idle_power_w": 2.0,
          "power_per_torque_w": 80.0,
          "axes_body": [
            [
              1.0,
              0.0,
              0.0
            ],
            [
              0.0,
              1.0,
              0.0
            ],
            [
              0.0,
              0.0,
              1.0
            ]
          ],
          "axis_mapping": "explicit_body_frame_spin_axis_matrix"
        },
        "initial_wheel_speed_rad_s": [
          88.861444,
          71.6856,
          108.48713
        ]
      },
      "environment_torques": {
        "enabled": {
          "gravity_gradient": true,
          "magnetic": true,
          "aerodynamic": false,
          "srp": false
        },
        "components_nm": {
          "gravity_gradient": [
            0.0,
            -4e-08,
            -1e-08
          ],
          "magnetic": [
            0.0,
            -2.4000000000000003e-06,
            0.0
          ],
          "aerodynamic": [
            0.0,
            0.0,
            0.0
          ],
          "srp": [
            0.0,
            0.0,
            0.0
          ]
        },
        "total_nm": [
          0.0,
          -2.4400000000000004e-06,
          -1e-08
        ],